{
  "format": "reqix-config",
  "version": 1,
  "exportedAt": 1788912000000,
  "groups": [],
  "rules": [
    {
      "id": "example-redirect",
      "groupId": "",
      "name": "重定向 · 本地接口",
      "enabled": false,
      "enabledIndex": 0,
      "url": "http://localhost:3000/api/legacy?source=demo",
      "matchType": "exact",
      "method": "GET",
      "pageScope": "specified",
      "pageUrlRules": [
        {
          "id": "page-local",
          "matchType": "exact",
          "value": "http://localhost:3000"
        }
      ],
      "statusCode": 200,
      "responseDelay": 0,
      "responseBody": "{}",
      "responseContentType": "application/json; charset=utf-8",
      "responseBodyMode": "static",
      "requestHeaderRules": [],
      "queryParamRules": [],
      "responseHeaderRules": [],
      "preserveRedirectQuery": true,
      "pipeline": {
        "request": {
          "headers": false,
          "data": false
        },
        "route": {
          "mode": "redirect"
        },
        "response": {
          "mode": "upstream",
          "headers": false,
          "delay": false
        }
      },
      "sort": 9,
      "hitCount": 0,
      "source": "manual",
      "createTime": 1788912000000,
      "updateTime": 1788912000000,
      "redirectUrl": "http://localhost:3000/api/echo"
    }
  ],
  "pageScripts": []
}
