{
  "format": "reqix-config",
  "version": 1,
  "exportedAt": 1788912000000,
  "groups": [],
  "rules": [
    {
      "id": "example-request-headers",
      "groupId": "",
      "name": "Request headers · demo environment",
      "enabled": false,
      "enabledIndex": 0,
      "url": "http://localhost:3000/api/echo",
      "matchType": "exact",
      "method": "GET",
      "pageScope": "specified",
      "pageUrlRules": [
        {
          "id": "page-local",
          "matchType": "exact",
          "value": "http://localhost:3000"
        }
      ],
      "statusCode": 200,
      "responseDelay": 0,
      "responseBody": "{}",
      "responseContentType": "application/json; charset=utf-8",
      "responseBodyMode": "static",
      "requestHeaderRules": [
        {
          "id": "x-demo-environment",
          "name": "X-Demo-Environment",
          "value": "staging",
          "operation": "modify"
        },
        {
          "id": "x-debug-trace",
          "name": "X-Debug-Trace",
          "value": "",
          "operation": "remove"
        }
      ],
      "queryParamRules": [],
      "responseHeaderRules": [],
      "preserveRedirectQuery": true,
      "pipeline": {
        "request": {
          "headers": true,
          "data": false
        },
        "route": {
          "mode": "origin"
        },
        "response": {
          "mode": "upstream",
          "headers": false,
          "delay": false
        }
      },
      "sort": 4,
      "hitCount": 0,
      "source": "manual",
      "createTime": 1788912000000,
      "updateTime": 1788912000000
    }
  ],
  "pageScripts": []
}
